{
  "schema_version": "exercise_pack_v1",
  "role": "author",
  "exercise_id": "ex_a200_d2_live",
  "node_id": "A200",
  "depth_target": "D2",
  "objective": "Write a function that takes ownership and returns it",
  "starter_files": [
    {
      "path": "src/lib.rs",
      "content": "pub fn take_and_return(s: String) -> String {\n    // TODO: return s\n    s\n}\n"
    }
  ],
  "test_files": [
    {
      "path": "tests/ownership.rs",
      "content": "#[test]\nfn test_take_and_return() {\n    let s = String::from(\"hello\");\n    let s2 = super::take_and_return(s);\n    assert_eq!(s2, \"hello\");\n}\n"
    }
  ],
  "run_instructions": {"commands": ["cargo test -q"]},
  "hint_policy": {"max_hint_level": 3, "reveal_allowed_before_threshold": false}
}
