{
  "schema_version": "exercise_pack_v1",
  "role": "author",
  "exercise_id": "ex_a203_d2",
  "node_id": "A203",
  "depth_target": "D2",
  "objective": "Fix conflicting mutable borrows",
  "starter_files": [{"path": "src/lib.rs", "content": "pub fn f() {}"}],
  "test_files": [{"path": "tests/aliasing.rs", "content": "#[test] fn t(){assert!(true);}"}],
  "run_instructions": {"commands": ["cargo test -q"]},
  "hint_policy": {"max_hint_level": 3, "reveal_allowed_before_threshold": false}
}
